{
  "$schema": "https://autotelic.dev/tackle/protocol/cutlist.config.json",
  "roots": ["src"],
  "alias": { "@/*": ["src/*"] },
  "tiers": {
    "primitive": ["components/ui"],
    "shared": ["components"],
    "local": ["routes"]
  },
  "tokens": {
    "from": "src/styles/app.css",
    "vars": "src/styles/app.css"
  },
  "hooks": { "barrel": "src/components" },
  "ownership": { "routeOwner": "first-segment", "transitive": false },
  "patterns": {
    "composition": { "providerSuffix": "Provider", "hookPrefix": "use" },
    "urlState": { "router": "tanstack", "reader": "useSearch" }
  },
  "output": {
    "catalog": "tools/ui-catalog/catalog.json",
    "manifest": "tools/ui-catalog/plumb-ui.config.json",
    "menuJson": "tools/ui-catalog/menu.json",
    "menu": "tools/ui-catalog/MENU.md",
    "intent": "tools/ui-catalog/intent",
    "hooks": "tools/ui-catalog/hooks.md",
    "tokens": "tools/ui-catalog/tokens.md"
  }
}
